http://52.203.230.115/txtimgsearch/?text_query=Ein+schwarzes+Hemdkleid.+Es+hat+einen+Hemdkragen+und+ist+ärmellos.+An+der+Tallie+hat+es+ein+Band.|Ein schwarzes Hemdkleid. Es hat einen Hemdkragen und ist ärmellos. An der Tallie hat es ein Band.
http://52.203.230.115/txtimgsearch/?text_query=Ein+knielanges,+hell+pinkes+Kleid.+Es+besitzt+einen+runden+Ausschnitt,+keine+Ärmel+und+die+Schultern+sind+frei.|Ein knielanges, hell pinkes Kleid. Es besitzt einen runden Ausschnitt, keine Ärmel und die Schultern sind frei.
http://52.203.230.115/txtimgsearch/?text_query=Ein+kurzärmliges+Kleid+,+das+deutlich+über+den+Knien+endet.+Der+dunkelblaue+Stoff+ist+mit+einem+weißen,+blattähnlichen+Muster+bedruckt.+DerAusschnitt+ist+rund+und+breit.+Um+die+Taille+ist+ein+schmales,+schwarzes+Band+geschlungen.+Der+Rockteil+weist+zwei+aufspringende+Abnäherfalten+auf.|Ein kurzärmliges Kleid , das deutlich über den Knien endet. Der dunkelblaue Stoff ist mit einem weißen, blattähnlichen Muster bedruckt.  DerAusschnitt ist rund und breit. Um die Taille ist ein schmales, schwarzes Band geschlungen. Der Rockteil weist zwei aufspringende Abnäherfalten auf.
http://52.203.230.115/txtimgsearch/?text_query=Langes+Sommerkleid+ohne+Ärmeln.+Das+Kleid+ist+grau/schwarz,+mit+rotem+Blumenmustern+am+Rock.+Es+reicht+bis+zu+den+Füßen.+Es+hat+einen+V-Ausschnitt.|Langes Sommerkleid ohne Ärmeln. Das Kleid ist grau/schwarz, mit rotem Blumenmustern am Rock. Es reicht bis zu den Füßen. Es hat einen V-Ausschnitt.
http://52.203.230.115/txtimgsearch/?text_query=Kurzes+sexy+Minikleid+mit+vertikalen+schmalen+roten+und+weißen+Streifen,+schulter+frei+mit+faltigen+Absatz+auf+Brust+Höhe+und+breiten+oben+offenen+Ärmeln.|Kurzes sexy Minikleid mit vertikalen schmalen roten und weißen Streifen, schulter frei mit faltigen Absatz auf Brust Höhe und breiten oben offenen Ärmeln.
http://52.203.230.115/txtimgsearch/?text_query=Ein+Knie+langes+Kleid+in+rot.+Es+hat+einen+runden+Halsausschnitt+und+lange+Ärmel.|Ein Knie langes Kleid in rot. Es hat einen runden Halsausschnitt und lange Ärmel.
http://52.203.230.115/txtimgsearch/?text_query=Ein+Dunkel-Rosa+kurzes+Minikleid,+mit+einem+geradem+Schulterfrei+Ausschnitt+einer+Rüsche+und+kurzen+Ärmeln.|Ein Dunkel-Rosa kurzes Minikleid, mit einem geradem Schulterfrei Ausschnitt einer Rüsche und kurzen Ärmeln.
http://52.203.230.115/txtimgsearch/?text_query=Ein+hellblaues+Kleid+mit+freien+Schultern+und+mittellangen+Ärmeln.+Es+hat+Stickmuster+an+den+Ärmeln+und+am+unteren+Ende.+Es+hat+einen+dezenten+V-Ausschnitt+und+fällt+bis+über+die+Hüfte.|Ein hellblaues Kleid mit freien Schultern und mittellangen Ärmeln. Es hat Stickmuster an den Ärmeln und am unteren Ende. Es hat einen dezenten V-Ausschnitt und fällt bis über die Hüfte.
http://52.203.230.115/txtimgsearch/?text_query=ärmelos,+mittelweiter+Ausschnitt,+band+oberhalb+der+hüfte,+blau,+unterhalb+weit+geschnitten|ärmelos, mittelweiter Ausschnitt, band oberhalb der hüfte, blau, unterhalb weit geschnitten
http://52.203.230.115/txtimgsearch/?text_query=Es+ist+ein+langes+weites+weißes+Kleid+ohne+Ärmel+und+mit+einem+V-Ausschitt.|Es ist ein langes weites weißes Kleid ohne Ärmel und mit einem V-Ausschitt.
http://52.203.230.115/txtimgsearch/?text_query=Rotes+Kleid,+fast+knielang,+keine+Ärmel.+Oben+Rüschen,+kein+Ausschnitt.+Nicht+tailliert.|Rotes Kleid, fast knielang, keine Ärmel. Oben Rüschen, kein Ausschnitt. Nicht tailliert.
http://52.203.230.115/txtimgsearch/?text_query=Es+ist+ein+leichtes+kurzes+Sommerkleid,+vertikal+zweifarbig+auf+der+einen+Seite+weiß+mit+rotem+Muster,+auf+der+anderen+Seite+anthrazit+mit+weißem+Muster.|Es ist ein leichtes kurzes Sommerkleid, vertikal zweifarbig auf der einen Seite weiß mit rotem Muster, auf der anderen Seite anthrazit mit weißem Muster.
http://52.203.230.115/txtimgsearch/?text_query=in+Kleid+das+hinten+zu+gemacht+wird+mit+einem+Hacken.+Es+hat+keine+Arme+und+die+Knie+sind+frei.|in Kleid das hinten zu gemacht wird mit einem Hacken. Es hat keine Arme und die Knie sind frei.
http://52.203.230.115/txtimgsearch/?text_query=Ein+langes,+dunkel+blaues+Kleid+mit+silbernem+Muster+auf+dem+Oberteil.+Es+liegt+am+Hals+an,+besitzt+keine+Ärmel+und+die+Schultern+sind+frei.|Ein langes, dunkel blaues Kleid mit silbernem Muster auf dem Oberteil. Es liegt am Hals an, besitzt keine Ärmel und die Schultern sind frei.
http://52.203.230.115/txtimgsearch/?text_query=dunkles+kurzes+Kleid+mit+hellem+Muster+nach+unten+etwas+weiter+ausgestellt+,+kleiner+Stehkragen+,+ärmellos+mit+passendem+schmalen+Gürtel|dunkles kurzes Kleid mit hellem Muster nach unten etwas weiter ausgestellt , kleiner Stehkragen , ärmellos mit passendem schmalen Gürtel
http://52.203.230.115/txtimgsearch/?text_query=Ein+olivfarbenes+Kleid.+Das+Kleid+aht+einen+Hemdkragen+und+halblange+Ärmel.+Das+Kleid+reicht+etwa+bis+zur+Mitte+der+Oberschenkel.|Ein olivfarbenes Kleid. Das Kleid aht einen Hemdkragen und halblange Ärmel. Das Kleid reicht etwa bis zur Mitte der Oberschenkel.
http://52.203.230.115/txtimgsearch/?text_query=schönes+weißes+Kleid+mit+einem+großen+Betrachtungshülse+Oberteil+ist+aus+Spitze+Boden+gemacht+ist+etwas+breiter+sehr+schön+und+stilvolles+Kleid.|schönes weißes Kleid mit einem großen Betrachtungshülse Oberteil ist aus Spitze Boden gemacht ist etwas breiter sehr schön und stilvolles Kleid.
http://52.203.230.115/txtimgsearch/?text_query=bunt+geblümtes+,+knie+langes+damen+kleid+,+eng+anliegend+mit+kurzen+ärmeln+,+schulterfrei+und+trägerlos|bunt geblümtes , knie langes damen kleid , eng anliegend mit kurzen ärmeln , schulterfrei und trägerlos
http://52.203.230.115/txtimgsearch/?text_query=Es+handelt+sich+um+ein+knielanges+Kleid+mit+runden+Ausschnitt+und+es+eignet+sich+ideal+für+die+XXL-Figur.|Es handelt sich um ein knielanges Kleid mit runden Ausschnitt und es eignet sich ideal für die XXL-Figur.
http://52.203.230.115/txtimgsearch/?text_query=Ein+schwarzes+Kleid+mit+rosa+Blumenmuster.+Es+hat+einen+runden+Ausschnitt+und+sehr+kurze+Ärmel.+Das+Kleid+reicht+etwa+bis+zur+Mitte+der+Oberschenkel.|Ein schwarzes Kleid mit rosa Blumenmuster. Es hat einen runden Ausschnitt und sehr kurze Ärmel. Das Kleid reicht etwa bis zur Mitte der Oberschenkel.
http://52.203.230.115/txtimgsearch/?text_query=weißes+knielanges+leger+geschnittenes+Kleid+in+Crepesstruktur+mit+schwarzen+schmalen+Bündchen+an+den+langen+Ärmeln+und+am+Ausschnitt|weißes knielanges leger geschnittenes Kleid in Crepesstruktur mit schwarzen schmalen Bündchen an den langen Ärmeln und am Ausschnitt
http://52.203.230.115/txtimgsearch/?text_query=weißess+kleid+mit+einem+sehr+schönen+blauen+blumenmuster,e+s+geht+bis+zu+den+Knie+und+ist+ein+weiter+Rock|weißess kleid mit einem sehr schönen blauen blumenmuster,e s geht bis zu den Knie und ist ein weiter Rock
http://52.203.230.115/txtimgsearch/?text_query=Es+ist+ein+Schwarzes+Kleid+für+Damen.+Es+hat+einen+runden+Ausschnitt+und+lange+Ärmel.+Es+ist+ein+weises+Muster+auf+dem+Kleid+angebracht.+Lediglich+der+untere+Teil+des+Kleides+ist+komplett+schwarz.|Es ist ein Schwarzes Kleid für Damen. Es hat einen runden Ausschnitt und lange Ärmel. Es ist ein weises Muster auf dem Kleid angebracht. Lediglich der untere Teil des Kleides ist komplett schwarz.
http://52.203.230.115/txtimgsearch/?text_query=Knielanges+Stoffkleid+in+blau,+tailliert.+Schulterfrei+mit+hohem+geradem+Kragen.|Knielanges Stoffkleid in blau, tailliert. Schulterfrei mit hohem geradem Kragen.
http://52.203.230.115/txtimgsearch/?text_query=Es+handelt+sich+um+ein+sehr+kurzes+und+sexy+Kleid.+Das+Kleid+ist+schwarz+hat+lange+Ämrel+und+wird+zugeknöpft.|Es handelt sich um ein sehr kurzes und sexy Kleid. Das Kleid ist schwarz hat lange Ämrel und wird zugeknöpft.
http://52.203.230.115/txtimgsearch/?text_query=schöne+Damen+über+dem+Knie+Farbe+dunkelblau+in+der+Mitte+Kleid+ein+schwarzer+Gürtel+mit+kurzen+Ärmeln+und+auf+beiden+Seiten+hat,+ist+mit+weißen+langen+Streife+sehr+schön+und+stilvoll+gemacht.|schöne Damen über dem Knie Farbe dunkelblau in der Mitte Kleid ein schwarzer Gürtel mit kurzen Ärmeln und auf beiden Seiten hat, ist mit weißen langen Streife sehr schön und stilvoll gemacht.
http://52.203.230.115/txtimgsearch/?text_query=weißes+Kleid+mit+Regenbogen+und+roten+Schuhen+grüner+Taschen,+sieht+kacke+aus|weißes Kleid mit Regenbogen und roten Schuhen grüner Taschen, sieht kacke aus
http://52.203.230.115/txtimgsearch/?text_query=Es+ist+ein+blaues+knielanges+gerade+geschnittenes+Kleid,+das+mit+Spitze+besetzt+ist.Es+hat+kleine+Flügelärmel.+Das+Oberteil+sieht+aus+als+ob+es+separat+ist.+es+hat+einen+runden+Ausschnitt.|Es ist ein blaues knielanges gerade geschnittenes Kleid, das mit Spitze besetzt ist.Es hat kleine Flügelärmel. Das Oberteil sieht aus als ob es separat ist. es hat einen runden Ausschnitt.
http://52.203.230.115/txtimgsearch/?text_query=Ein+kurzes,+schwarzes+Kleid+mit+silbernem+Streifen-Muster.+Es+besitzt+einen+tiefen+V-Ausschnitt+und+keine+Ärmel.|Ein kurzes, schwarzes Kleid mit silbernem Streifen-Muster. Es besitzt einen tiefen V-Ausschnitt und keine Ärmel.
http://52.203.230.115/txtimgsearch/?text_query=schwarzes+kleid+mit+einer+sher+großen+dekorativen+schleife+um+den+halsmit+weiß+gesäumten+rand+ansonsten+ist+es+schlicht+gehalten|schwarzes kleid mit einer sher großen dekorativen schleife um den halsmit weiß gesäumten rand ansonsten ist es schlicht gehalten
http://52.203.230.115/txtimgsearch/?text_query=Es+ist+ein+dunkelblaues+sehr+kurzes+Ballkleid,+das+breite+Träger+aus+Spitze+hat+,das+Oberteil+ist+aus+Spitze+und+der+Rock+ist+weit+schwingend+es+ist+auf+Taillie+geschnitten+um+die+Taillie+sieht+es+aus+wie+ein+breites+Band.+Vorne+ist+ein+runder+im+Rücken+ein+tiefer+spitzer+Ausschnitt.|Es ist ein dunkelblaues sehr kurzes Ballkleid, das breite Träger aus Spitze hat ,das Oberteil ist aus Spitze und der Rock ist weit schwingend es ist auf Taillie geschnitten um die Taillie sieht es aus wie ein breites Band. Vorne ist ein runder im Rücken ein tiefer spitzer Ausschnitt.
http://52.203.230.115/txtimgsearch/?text_query=ein+karoartiges+muster+bei+eienem+hemdkleid+mit+kragen+und+schwarz+weiß+.vorne+schlaufe+in+schwarz|ein karoartiges muster bei eienem hemdkleid mit kragen und schwarz weiß .vorne schlaufe in schwarz
http://52.203.230.115/txtimgsearch/?text_query=Langärmliges+helles+Sommerkleid+mit+bunten+Blumen+Muster.+Das+Kleid+ist+aus+dünnem+Stoff+und+hat+einen+V-Ausschnitt.+Es+geht+bis+zu+den+Knöcheln.|Langärmliges helles Sommerkleid mit bunten Blumen Muster. Das Kleid ist aus dünnem Stoff und hat einen V-Ausschnitt. Es geht bis zu den Knöcheln.
http://52.203.230.115/txtimgsearch/?text_query=Dunkel+graues+kurzes+Minikleid+mit+kurzen+Ärmeln+und+breiten+runden+Ausschnitt,+tailliert+und+mit+Spitzen+Applikationen+über+das+gesamte+Kleid.|Dunkel graues kurzes Minikleid mit kurzen Ärmeln und breiten runden Ausschnitt, tailliert und mit Spitzen Applikationen über das gesamte Kleid.
http://52.203.230.115/txtimgsearch/?text_query=Ein+hummerfarbenes+Abendkleid,+das+vorne+knapp+knielang+ist+und+hinten+lang.+Das+Oberteil+ist+anliegend,+ärmellos,+mit+rundem+Ausschnitt+und+tiefen+Armausschnitten.+Über+der+Taille+sind+zwei+streifenförmige+Aussparungen+angebracht,+die+Haut+hervorblitzen+lassen,+Der+Rock+schwingt.|Ein hummerfarbenes Abendkleid, das vorne knapp knielang ist und hinten lang. Das Oberteil ist anliegend, ärmellos, mit rundem Ausschnitt und tiefen Armausschnitten. Über der Taille sind zwei streifenförmige Aussparungen angebracht, die Haut hervorblitzen lassen, Der Rock schwingt.
http://52.203.230.115/txtimgsearch/?text_query=Ein+hellblaues+Kleid+mit+einem+runden+Ausschnitt+und+langen+Ärmel+welche+nach+vorne+weiter+geschnitten+sind+und+es+hat+auf+beiden+je+3+Schleifen+verteilt+auf+der+Armlänge.+Es+fällt+bis+über+die+Hüfte+und+ist+locker+geschnitten.|Ein hellblaues Kleid mit einem runden Ausschnitt und langen Ärmel welche nach vorne weiter geschnitten sind und es hat auf beiden je 3 Schleifen verteilt auf der Armlänge. Es fällt bis über die Hüfte und ist locker geschnitten.
http://52.203.230.115/txtimgsearch/?text_query=Ein+Schwarzes+kurzes+einem+T-Shirt+ähnliches+Minikleid,+mit+einem+Weißem+Schriftzug+am+Saum+und+den+kurzen+Ärmeln.|Ein Schwarzes kurzes einem T-Shirt ähnliches Minikleid, mit einem Weißem Schriftzug am Saum und den kurzen Ärmeln.
http://52.203.230.115/txtimgsearch/?text_query=Es+ist+ein+kurzes+leichtes+rosa+Kleid,+schulterfrei,+leicht+tailliert+und+mit+raffiniert+geschnit4nen+Ärmeln.|Es ist ein kurzes leichtes rosa Kleid, schulterfrei, leicht tailliert und mit raffiniert geschnit4nen Ärmeln.
http://52.203.230.115/txtimgsearch/?text_query=schwarzes+Langes+kleid+welches+über+den+Boden+schleift+es+hat+eien+riunden+engen+Ausschnitt+und+die+Träger+sind+knapp+10+cm|schwarzes Langes kleid welches über den Boden schleift es hat eien riunden engen Ausschnitt und die Träger sind knapp 10 cm
http://52.203.230.115/txtimgsearch/?text_query=Hübsches+halblanges+helles+Damenkleid+mit+halblangen+Ärmeln+und+hohem+runden+Ausschnitt.+Der+Rock+wirft+Hübsche+Falten.|Hübsches halblanges helles Damenkleid mit halblangen Ärmeln und hohem runden Ausschnitt. Der Rock wirft Hübsche Falten.
http://52.203.230.115/txtimgsearch/?text_query=Ein+kurzes,+blaues+Kleid+mit+angeschnittenen,+kurzen+Ärmeln.+Der+Stoff+wirkt+T-Shirt-artig,+das+Kleid+ist+weit+geschnitten.+Der+Ausschnitt+ist+rund.+Durch+ein+schmales+Stoffband,+das+vorne+im+Mittebereich+aus+dem+Kleid+ragt,+wird+das+Kleid+im+Hüftbereich+gerafft,+das+Stoffband+ist+zu+einer+Schleife+gebunden.+An+den+Seiten+des+locker+fallenden+Rockteils+befindet+sich+je+eine+Eingrifftasche.|Ein kurzes, blaues Kleid mit angeschnittenen, kurzen Ärmeln. Der Stoff wirkt T-Shirt-artig, das Kleid ist weit geschnitten. Der Ausschnitt ist rund. Durch ein schmales Stoffband, das vorne im Mittebereich aus dem Kleid ragt, wird das Kleid im Hüftbereich gerafft, das Stoffband ist zu einer Schleife gebunden. An den Seiten des locker fallenden Rockteils befindet sich je eine Eingrifftasche.
http://52.203.230.115/txtimgsearch/?text_query=Ein+Dunkelgraues+mit+vielen+weißen+Blumen+Bedruckt+knielanges+Kleid,+mit+Ziernaht+in+Bauchhöhe,+weitem+Rock,+halbrundem+ausschnitt+und+kurzen+Ärmeln.|Ein Dunkelgraues mit vielen weißen Blumen Bedruckt knielanges Kleid, mit Ziernaht in Bauchhöhe, weitem Rock, halbrundem ausschnitt und kurzen Ärmeln.
http://52.203.230.115/txtimgsearch/?text_query=Knielanges+Stoffkleid+mit+dunkelblauem+Faltenrock+und+weißem+Sptzienoberteil+mit+hohem+Kragen+und+kurzen+Ärmeln.|Knielanges Stoffkleid mit dunkelblauem Faltenrock und weißem Sptzienoberteil mit hohem Kragen und kurzen Ärmeln.
http://52.203.230.115/txtimgsearch/?text_query=schöne+Damen+kleiden+lang+über+dem+Knie+Farbe+weiß+mit+schwarzen+Blumen+und+mittlere+Gürtel+schön+und+stilvoll.|schöne Damen kleiden lang über dem Knie Farbe weiß mit schwarzen Blumen und mittlere Gürtel schön und stilvoll.
http://52.203.230.115/txtimgsearch/?text_query=Ein+hellgraues,+knielanges+Kleid+mit+weißen+Punkten.+Das+Kleid+hat+kleine+Flügelärmel+und+einen+runden+Ausschnitt.+Ein+Stoffband+in+der+Taille+kann+zur+Schleife+gebunden+werden,+der+Rock+ist+weit+schwingend.|Ein hellgraues, knielanges Kleid mit weißen Punkten. Das Kleid hat kleine Flügelärmel und einen runden Ausschnitt. Ein Stoffband in der Taille kann zur Schleife gebunden werden, der Rock ist weit schwingend.
http://52.203.230.115/txtimgsearch/?text_query=Es+ist+ein+kurzes+mehrfarbiges+Sommerkleid+das+auf+Taillie+geabeitet+ist.Es+hat+keine+Ärmel+und+einen+runden+Ausschnitt.Die+Grundfarbe+ist+weiss+blaue+und+rote+Blumen+mit+etwas+grün.Es+hat+einen+schmalen+roten+Gürtel.|Es ist ein kurzes mehrfarbiges Sommerkleid das auf Taillie geabeitet ist.Es hat keine Ärmel und einen runden Ausschnitt.Die Grundfarbe ist weiss blaue und rote Blumen mit etwas grün.Es hat einen schmalen roten Gürtel.
http://52.203.230.115/txtimgsearch/?text_query=Ein+bis+etwas+unterhalb+die+Knie+reichendes,+hemdartiges+Kleid.+Der+weiße+Stoff+ist+mit+divers+breiten,+dunkelblauen+Längsstreifen+bedruckt,+die+langen+Ärmel+haben+quer+gestreifte+Krempen.+Das+Kleid+hat+einen+schmaler+Stehkragen,+vorn+ist+das+Kleid+bis+unter+die+Brust+mit+kleinen,+weißen+Knöpfen+zu+schließen.+Das+blind+um+die+Taille+gewundene,+schmale+Stoffband+ist+in+der+Mitte+zu+einer+Schleife+gebunden.+Der+Rocksaum+ist+leicht+gerundet,hinten+ist+der+Rock+fast+eine+handbreit+länger+als+vorn.|Ein bis etwas unterhalb die Knie reichendes, hemdartiges Kleid. Der weiße Stoff ist mit divers breiten, dunkelblauen Längsstreifen bedruckt, die langen Ärmel haben quer gestreifte Krempen. Das Kleid hat einen schmaler Stehkragen, vorn ist das Kleid bis unter die Brust mit kleinen, weißen Knöpfen zu schließen. Das blind um die Taille gewundene, schmale Stoffband ist in der Mitte zu einer Schleife gebunden. Der Rocksaum ist leicht gerundet,hinten ist der Rock fast eine handbreit länger als vorn.
http://52.203.230.115/txtimgsearch/?text_query=Ein+weißes,+knielanges+Kleid.+Es+hat+einen+Rundausschnitt+und+keine+Ärmel.+Es+ist+figurbetont.+Der+Rock+ist+ausgestellt+und+hat+Falten.+Es+hat+ein+großflächigen+blauen+Blumenaufdruck.|Ein weißes, knielanges Kleid. Es hat einen Rundausschnitt und keine Ärmel. Es ist figurbetont. Der Rock ist ausgestellt und hat Falten. Es hat ein großflächigen blauen Blumenaufdruck.
http://52.203.230.115/txtimgsearch/?text_query=Ein+etwas+knielanges+Shirt-Kleid+mit+kurzen+Ärmeln.+Das+Kleid+ist+schwarz,+mit+Blumenmustern+und+Schriftzügen+am+Rock.+Es+hat+einen+runden+Ausschnitt.|Ein etwas knielanges Shirt-Kleid mit kurzen Ärmeln. Das Kleid ist schwarz, mit Blumenmustern und Schriftzügen am Rock. Es hat einen runden Ausschnitt.
http://52.203.230.115/txtimgsearch/?text_query=Ein+schwarz-hellbraun+gestreiftes,+knielanges+Kleid+ohne+Ärmel+und+mit+rundem+Ausschnitt.+Das+Oberteil+ist+figurbetont,+der+Rock+weit+schwingend.|Ein schwarz-hellbraun gestreiftes, knielanges Kleid ohne Ärmel und mit rundem Ausschnitt. Das Oberteil ist figurbetont, der Rock weit schwingend.
http://52.203.230.115/txtimgsearch/?text_query=Ein+über+die+Knie+reichendes+schwarzes+Kleid.+Es+hat+einen+V-förmigen+Ausschnitt.+Die+Ärmel+sind+lang+und+ab+dem+Ellenbogen+sehr+stark+faltig+aufgeweitet.|Ein über die Knie reichendes schwarzes Kleid. Es hat einen V-förmigen Ausschnitt. Die Ärmel sind lang und ab dem Ellenbogen sehr stark faltig aufgeweitet.
http://52.203.230.115/txtimgsearch/?text_query=schwarzes+mit+bunten+Blumen+bedrucktes+Minikleid+,+nach+unten+hin+leicht+ausgestellt+,+breite+Träger+,+weiter+runder+Ausschnitt|schwarzes mit bunten  Blumen bedrucktes Minikleid , nach unten hin leicht ausgestellt , breite Träger , weiter runder Ausschnitt
http://52.203.230.115/txtimgsearch/?text_query=rotes+Klied+welches+an+den+waden+bis+zum+boden+geht+aber+vorne+schon+auf+knie+höhe+aufhört|rotes Klied welches an den waden bis zum boden geht aber vorne schon auf knie höhe aufhört
http://52.203.230.115/txtimgsearch/?text_query=ein+kleid+mit+rosa+grauem+muster.+es+sit+knielang+und+hat+keine+ärmel|ein kleid mit rosa grauem muster. es sit knielang und hat keine ärmel
http://52.203.230.115/txtimgsearch/?text_query=Es+ist+ein+blaues+Kasack+mit+weißen+Blumen+drauf.+Er+hat+kurze+Ärmel+und+einen+spitzen+Ausschnitt.|Es ist ein blaues Kasack mit weißen Blumen drauf. Er hat kurze Ärmel und einen spitzen Ausschnitt.
http://52.203.230.115/txtimgsearch/?text_query=Fuchsiafarbenes+kurzes+Strickkleid.+Wickelkleid,+links+schließbar.+V-Ausschnitt.+Rock+ausgestellt,+locker+schwingend.|Fuchsiafarbenes kurzes Strickkleid. Wickelkleid, links schließbar. V-Ausschnitt. Rock ausgestellt, locker schwingend.
http://52.203.230.115/txtimgsearch/?text_query=Es+handelt+sich+um+ein+Kleid+das+dunkelblau+ist.+Das+Kleid+hat+keine+Ärmel+und+eine+runden+Ausschnitt.+Dieses+Kleid+hat+einen+sehr+feinen+schwarzen+Gürtel.|Es handelt sich um ein Kleid das dunkelblau ist. Das Kleid hat keine Ärmel und eine runden Ausschnitt. Dieses Kleid hat einen sehr feinen schwarzen Gürtel.
http://52.203.230.115/txtimgsearch/?text_query=hautfarbenes+bis+hin+zu+rosa+kleid,+es+besteht+wohl+aus+SPitze+und+hat+einen+schlictz+an+den+beienn|hautfarbenes bis hin zu rosa kleid, es besteht wohl aus SPitze und hat einen schlictz an den beienn
http://52.203.230.115/txtimgsearch/?text_query=Langes+Kleid+ohne+Ärmeln.+Das+Kleid+ist+rosa+ohne+Motive+am+Rock.+Es+reicht+bis+zu+den+Füßen+und+hat+einen+weiten+V-Ausschnitt.|Langes Kleid ohne Ärmeln. Das Kleid ist rosa ohne Motive am Rock. Es reicht bis zu den Füßen und hat einen weiten V-Ausschnitt.
http://52.203.230.115/txtimgsearch/?text_query=Schulter+freies+ärmelloses+langes+rotes+Kleid+mit+aufgesetzten+breiten+Band+im+Brust+Bereich,+sehr+tailliert.|Schulter freies ärmelloses langes rotes Kleid mit aufgesetzten breiten Band im Brust Bereich, sehr tailliert.
http://52.203.230.115/txtimgsearch/?text_query=Knie+langes+stark+gemustertes+Kleid+da+vorne+etwas+kürzer+ist.+Es+hat+einen+V-Ausschnitt+und+halb+lange+Arme.|Knie langes stark gemustertes Kleid da vorne etwas kürzer ist. Es hat einen V-Ausschnitt und halb lange Arme.
http://52.203.230.115/txtimgsearch/?text_query=ein+schwarzes+kurzes+kleid+mit+langen+armen+sehr+leicht+fallend+und+schön|ein schwarzes kurzes kleid mit langen armen sehr leicht fallend und schön
http://52.203.230.115/txtimgsearch/?text_query=Ein+langes,+dunkel+blaues+Kleid+mit+silbernem+Muster+auf+dem+Oberteil.+Es+liegt+am+Hals+an,+besitzt+keine+Ärmel+und+die+Schultern+sind+frei.|Ein langes, dunkel blaues Kleid mit silbernem Muster auf dem Oberteil. Es liegt am Hals an, besitzt keine Ärmel und die Schultern sind frei.
http://52.203.230.115/txtimgsearch/?text_query=Kurzes+Kleid+mit+dünnen+Trägern,+schultern+sind+frei+an+den+Ellenbogen+sind+Ärmel.|Kurzes Kleid mit dünnen Trägern, schultern sind frei an den Ellenbogen sind Ärmel.
http://52.203.230.115/txtimgsearch/?text_query=Ein+hellblaues+ärmelloses+Kleid+mit+einem+Kragen+Band.+Es+fällt+bis+über+die+Hüfte+und+hat+einen+dünnen+Saum+um+den+Bauch.|Ein hellblaues ärmelloses Kleid mit einem Kragen Band. Es fällt bis über die Hüfte und hat einen dünnen Saum um den Bauch.
http://52.203.230.115/txtimgsearch/?text_query=Enganliegendes+weißes+Minikleid+mit+geschlossenem+Ausschnitt+und+langen+Ärmel+und+schmalen+vertikalen+Streifen.|Enganliegendes weißes Minikleid mit geschlossenem Ausschnitt und langen Ärmel und schmalen vertikalen Streifen.
http://52.203.230.115/txtimgsearch/?text_query=ein+graues+kleid.+ees+hat+auf+der+rechten+seite+einen+träger+und+links+einen+langen+ärmel.+der+schnitt+wirkt+figurbetont.+der+rock+hat+vorne+einen+schlitz,+der+bis+zu+oberschenkel+reicht.+der+rock+geht+bis+kurz+über+das+knie.|ein graues kleid. ees hat auf der rechten seite einen träger und links einen langen ärmel. der schnitt wirkt figurbetont. der rock hat vorne einen schlitz, der bis zu oberschenkel reicht. der rock geht bis kurz über das knie.
http://52.203.230.115/txtimgsearch/?text_query=Knielanges,+schwarzes+Kleid.+Das+Kleid+ist+schulterfrei.+Ärmelende+und+Rockende+sind+mit+Spitze.|Knielanges, schwarzes Kleid. Das Kleid ist schulterfrei. Ärmelende und Rockende sind mit Spitze.
http://52.203.230.115/txtimgsearch/?text_query=Halblanges+ärmelloses+dunkelblaues+Damenkleid+mit+Spitzen+Applikationen+im+Oberteil+und+schmalem+geknoteten+Gürtelband.|Halblanges ärmelloses dunkelblaues Damenkleid mit Spitzen Applikationen im Oberteil und schmalem geknoteten Gürtelband.
http://52.203.230.115/txtimgsearch/?text_query=Ein+kurzes,+weißes+Kleid+mit+pink,+grauen+Mustern.+Es+besitzt+einen+runden+Ausschnitt+und+kurze+Ärmel.|Ein kurzes, weißes Kleid mit pink, grauen Mustern. Es besitzt einen runden Ausschnitt und kurze Ärmel.
http://52.203.230.115/txtimgsearch/?text_query=Haben+Sie+ein+graues+Kleid+mit+halben+Ärmeln.+Keine+Muster.+Unter+dem+Knie|Haben Sie ein graues Kleid mit halben Ärmeln. Keine Muster. Unter dem Knie
http://52.203.230.115/txtimgsearch/?text_query=Ein+schwarzes+Tshirtkleid.+Es+hat+einen+runden+Ausschnitt+und+kurze+Ärmel.+Das+Kleid+reicht+etwa+bis+zur+Mitte+der+Oberschenkel.|Ein schwarzes Tshirtkleid. Es hat einen runden Ausschnitt und kurze Ärmel. Das Kleid reicht etwa bis zur Mitte der Oberschenkel.
http://52.203.230.115/txtimgsearch/?text_query=Ein+kurzes,+ärmelloses+Kleid.+Auf+den+weißen+Stoff+des+Oberteils+mit+rundem+Ausschnitt+sind+schwarze,+blütenartige+Gebilde+aufgedruckt,+auf+den+schwarzen+Rockteil+weiße,+derartige+Gebilde.+Der+weite+Rock+fällt+in+Wellen.|Ein kurzes, ärmelloses Kleid. Auf den weißen Stoff des Oberteils mit rundem Ausschnitt sind schwarze, blütenartige Gebilde aufgedruckt, auf den schwarzen Rockteil  weiße, derartige Gebilde.  Der weite Rock fällt in Wellen.
http://52.203.230.115/txtimgsearch/?text_query=Dunkles+knielanges+Damenkleid+mit+weißen+Punkten.+Ärmellos+mit+tiefem+V+Ausschnitt+und+schmalem+Gürtelband.|Dunkles knielanges Damenkleid mit weißen Punkten. Ärmellos mit tiefem V Ausschnitt und schmalem Gürtelband.
http://52.203.230.115/txtimgsearch/?text_query=Ärmelloses+knielanges+schwarzes+Damenkleid+mit+hauchdünnen+Trägern+und+Dekollete+betonendem+V+Ausschnitt.|Ärmelloses knielanges schwarzes Damenkleid mit hauchdünnen Trägern und Dekollete betonendem V Ausschnitt.
http://52.203.230.115/txtimgsearch/?text_query=Knielanges+Kleid+mit+langen+Ärmeln.+Das+Kleid+ist+grau+und+ohne+Motive+am+Rock.+Es+wirkt+sehr+figurbetont.+Es+hat+einen+weiten+runden+Ausschnitt.|Knielanges Kleid mit langen Ärmeln. Das Kleid ist grau und ohne Motive am Rock. Es wirkt sehr figurbetont. Es hat einen weiten runden Ausschnitt.
http://52.203.230.115/txtimgsearch/?text_query=Extravagantes+Minikleid+in+der+Frabe+Orange,+schulterfrei+und+lange+Ärmel.+Die+Länge+des+Kleides+endet+detlich+über+dem+Knie.|Extravagantes Minikleid in der Frabe Orange, schulterfrei und lange Ärmel. Die Länge des Kleides endet detlich über dem Knie.
