http://52.203.230.115/txtimgsearch/?text_query=ein+graues+kleid+mit+kurzen+armen.+großes+runder+ausschnit+am+hals.+es+iat+nicht+lang+geschnitten+.+die+Knie+sind+frei.|ein graues kleid mit kurzen armen. großes runder ausschnit am hals. es iat nicht lang geschnitten . die Knie sind frei.
http://52.203.230.115/txtimgsearch/?text_query=Dies+ist+ein+schwarzes+mittellanges+Kleid+mit+bunt+aufgedrucktem+Blumenmuster.+Es+hat+kurze+Ärmel.+Oben+hat+es+einen+V-förmigen+Halsauschnitt.|Dies ist ein schwarzes mittellanges Kleid mit bunt aufgedrucktem Blumenmuster. Es hat kurze Ärmel. Oben hat es einen V-förmigen Halsauschnitt.
http://52.203.230.115/txtimgsearch/?text_query=Es+ist+ein+beigefarbenes+gerade+geschnittenes+knielanges+Spitzenkleid,+das+keine+Ärmel+hat.+Es+hat+einen+runden+Ausschnitt+und+am+Rock+an+der+seite+einen+Schlitz.Das+Oberteil+hat+noch+weisse+Verzierungen.|Es ist ein beigefarbenes gerade geschnittenes knielanges Spitzenkleid, das keine Ärmel hat. Es hat einen runden Ausschnitt und am Rock an der seite einen Schlitz.Das Oberteil hat noch weisse Verzierungen.
http://52.203.230.115/txtimgsearch/?text_query=Ein+Kleid+mit+adidas+auf+Druck+vorne+auf+der+Brust.+Es+hat+kurze+Arme+und+die+Knie+sind+frei.|Ein Kleid mit adidas auf Druck vorne auf der Brust. Es hat kurze Arme und die Knie sind frei.
http://52.203.230.115/txtimgsearch/?text_query=Knielanges+Stoffkleid+mit+schwarzem+Faltenrock,+Ledergürtel+und+weißem+Oberteil+mit+tiefem+rundem+Ausschnitt+und+langen+Ärmeln.|Knielanges Stoffkleid mit schwarzem Faltenrock, Ledergürtel und weißem Oberteil mit tiefem rundem Ausschnitt und langen Ärmeln.
http://52.203.230.115/txtimgsearch/?text_query=Ein+schwarzes+Kleid+mit+rosa+Blumenmuster.+Es+hat+einen+runden+Ausschnitt+und+sehr+kurze+Ärmel.+Das+Kleid+reicht+etwa+bis+zur+Mitte+der+Oberschenkel.|Ein schwarzes Kleid mit rosa Blumenmuster. Es hat einen runden Ausschnitt und sehr kurze Ärmel. Das Kleid reicht etwa bis zur Mitte der Oberschenkel.
http://52.203.230.115/txtimgsearch/?text_query=Es+handelt+sich+um+ein+dunkelgraues+Kleid+mit+Rundausschnitt.+Es+endet+auf+Höhe+der+Oberschenkel+und+bedeckt+die+Schultern.|Es handelt sich um ein dunkelgraues Kleid mit Rundausschnitt. Es endet auf Höhe der Oberschenkel und bedeckt die Schultern.
http://52.203.230.115/txtimgsearch/?text_query=Ein+rotes,+knielanges+Kleid.+Es+hat+einen+U-Boot-förmigen+Ausschnitt+und+ellenbogenlange,+weite+Ärmel.|Ein rotes, knielanges Kleid. Es hat einen U-Boot-förmigen Ausschnitt und ellenbogenlange, weite Ärmel.
http://52.203.230.115/txtimgsearch/?text_query=ein+dunkelblaues+abendkleid+mit+einem+silberfarbenen+muster.+der+ausschnitt+fällt+bis+über+die+schultern.+es+hat+dreiviertellange+ärmel+und+der+rock+geht+bis+zum+boden.|ein dunkelblaues abendkleid mit einem silberfarbenen muster. der ausschnitt fällt bis über die schultern. es hat dreiviertellange ärmel und der rock geht bis zum boden.
http://52.203.230.115/txtimgsearch/?text_query=Ein+schwarz+und+weiß+gestreiftes+Kleid.+ES+hat+einen+runden+Ausschnitt+und+keine+Ärmel.+Das+Kleid+reicht+etwa+bis+zur+Mitte+der+Oberschenkel.|Ein schwarz und weiß gestreiftes Kleid. ES hat einen runden Ausschnitt und keine Ärmel. Das Kleid reicht etwa bis zur Mitte der Oberschenkel.
http://52.203.230.115/txtimgsearch/?text_query=Hellbalues+kurzes+Kleid+mit+buntem+Aufdruck.+V-ausschnitt.+Rock+unter+Brust+angesetzt.+Durchsichtiger+Streifen+unter+Brust+und+in+der+selben+Höhe+auf+Armen.+Ärmel+lang+ab+Streifen+weit+ausgestellt.+Alles+luftig+fallend.|Hellbalues kurzes Kleid mit buntem Aufdruck. V-ausschnitt. Rock unter Brust angesetzt. Durchsichtiger Streifen unter Brust und in der selben Höhe auf Armen. Ärmel lang ab Streifen weit ausgestellt. Alles luftig fallend.
http://52.203.230.115/txtimgsearch/?text_query=Boden+langes+Kleid+mit+einem+transparenten+Saum+am+Ende.+Es+hat+einen+gezackten+Rundhals+und+kurze+Arme.|Boden langes Kleid mit einem transparenten Saum am Ende. Es hat einen gezackten Rundhals und kurze Arme.
http://52.203.230.115/txtimgsearch/?text_query=Das+ist+ein+kurzes+rotes+Kleid+mit+kurzen+<Ärmeln+und+rechtsd+und+links+vom+Ausschnitt+je+einen+Knopf+zur+Verzierung.|Das ist ein kurzes rotes Kleid mit kurzen <Ärmeln und rechtsd und links vom Ausschnitt je einen Knopf zur Verzierung.
http://52.203.230.115/txtimgsearch/?text_query=Es+handelt+sich+um+ein+knielanges+beige+ohne+Ärmel+und+einen+runden+Ausschnitt.|Es handelt sich um ein knielanges beige ohne Ärmel und einen runden Ausschnitt.
http://52.203.230.115/txtimgsearch/?text_query=Ein+schwarzes+kurzes+Kleid+mit+weißen+Punkten+und+halblangem+Arm|Ein schwarzes kurzes Kleid mit weißen Punkten und halblangem Arm
http://52.203.230.115/txtimgsearch/?text_query=Langes+pinkes+Kleid+mit+Neckholder.+Die+Schultern+sind+frei+und+ohne+Ärmel.+Tailliert+und+mit+Schlitz+am+Bein.|Langes pinkes Kleid mit Neckholder. Die Schultern sind frei und ohne Ärmel. Tailliert und mit Schlitz am Bein.
http://52.203.230.115/txtimgsearch/?text_query=Jacket+ähnliches+Minikleid+schwarz+mit+langen+Ärmeln+und+ovalen+tiefen+Ausschnitt+sowie+Halsband.|Jacket ähnliches Minikleid schwarz mit langen Ärmeln und ovalen tiefen Ausschnitt sowie Halsband.
http://52.203.230.115/txtimgsearch/?text_query=Kurzes+gerade+geschnittenes+Kleid.+Es+hat+einen+schmalen+V-Ausschnitt+und+kurze+faltige+Arme.|Kurzes gerade geschnittenes Kleid. Es hat einen schmalen V-Ausschnitt und kurze faltige Arme.
http://52.203.230.115/txtimgsearch/?text_query=Ein+kurzes,+weißes+Spitzenkleid+mit+einem+Blumenmuster.+Es+hat+einen+am+Saum+weit+gezackten+Stehkragen.+Die+Ärmel+sind+kurz+und+am+Saum+ebenfalls+gezackt,+so+wie+auch+der+Rocksaum.+Der+Rock+ist+ausgestellt.+Unter+dem+transparent+weißen+Spitzenstoff+ist+ein+blickdichtes,+weißes+Unterkleid+mit+rundem+Ausschnitt+angebracht.|Ein kurzes, weißes Spitzenkleid mit einem Blumenmuster. Es hat einen am Saum weit gezackten Stehkragen. Die Ärmel sind kurz und am Saum ebenfalls gezackt, so wie auch der Rocksaum. Der Rock ist ausgestellt. Unter dem transparent weißen Spitzenstoff ist ein blickdichtes, weißes Unterkleid mit rundem Ausschnitt angebracht.
http://52.203.230.115/txtimgsearch/?text_query=ein+schwarzes+längeres+kleid+mit+leichtem+rock+und+kurzen+armen|ein schwarzes längeres kleid mit leichtem rock und kurzen armen
http://52.203.230.115/txtimgsearch/?text_query=Waden+langes+bequemes+Kleid+.Es+hat+einen+leichten+V-Ausschnitt+und+kurze+Ärmel.|Waden langes bequemes Kleid .Es hat einen leichten V-Ausschnitt und kurze Ärmel.
http://52.203.230.115/txtimgsearch/?text_query=Ein+Kleid+mit+rundem+Hals+aus+schnitt.+Die+länge+ist+bis+über+den+Knie.|Ein Kleid mit rundem Hals aus schnitt. Die länge ist bis über den Knie.
http://52.203.230.115/txtimgsearch/?text_query=Ein+schwatzes+Hemd-Kleid,+sehr+kurz.+Das+Modell+mit+Kent-Kragen+wird+mit+einer+durchgehenden+versteckten+Knopfleiste+vorne+geschlossen.+Lange+Ärmel+mit+Manschetten+verleihen+dem+Kleid+das+interessante+Note+durch+Spitzeneinsätze+an+den+Seiten.+Auch+im+Brustbereich+sind+Spitzenstreifen+eingearbeitet.|Ein schwatzes Hemd-Kleid, sehr kurz. Das Modell mit Kent-Kragen wird mit einer durchgehenden versteckten Knopfleiste vorne geschlossen. Lange Ärmel mit Manschetten  verleihen dem Kleid das interessante Note durch Spitzeneinsätze an den Seiten. Auch im Brustbereich sind Spitzenstreifen eingearbeitet.
